{
  "artifact_checksum_sha256": "0000000000000000000000000000000000000000000000000000000000000000",
  "artifact_filename": "artifact.bin",
  "byte_size": 128,
  "contract_version": 1,
  "created_at": "2026-01-30T07:00:00+00:00",
  "generation_id": "8e72c709c75e748fea2df9642ca47fb8d2b0d92f21d9db5ef2f168ab0ae1db73",
  "manifest_digest_sha256": "ff279506436f2671b62af3acc4052faa49d272ce1029ee20023f0ac8a02136c9",
  "model_run_content_generation_id": "0000000000000000000000000000000000000000000000000000000000000000",
  "quality_report_checksum_sha256": "0000000000000000000000000000000000000000000000000000000000000000",
  "run_id": "00000000-0000-4000-8000-000000000001",
  "runtime_import_path": "qlib",
  "runtime_name": "qlib",
  "runtime_version": "0.9.6",
  "serialization_profile_id": "uq-artifact-v1"
}
